[{"andar":0,"andares":0,"ano_construcao":0,"area":78.0,"area_terreno":78.0,"area_util":0.0,"bairro":"Centro","banheiros":1,"cidade":"Londrina","cliente_id":"00001","features":[],"finalidade":"venda","foto":"https://images.unsplash.com/photo-1560518883-ce09059eeffa?auto=format&fit=crop&w=1200&q=80","id":"00001-tst-001","preco":420000.0,"preco_aluguel":420000.0,"preco_venda":420000.0,"quartos":2,"subtipo":"","suites":0,"tipo":"apartamento","titulo":"Apartamento no Centro","uf":"PR","vagas":1},{"andar":0,"andares":0,"ano_construcao":0,"area":145.0,"area_terreno":145.0,"area_util":0.0,"bairro":"Vila Casoni","banheiros":2,"cidade":"Londrina","cliente_id":"00001","features":[],"finalidade":"venda","foto":"https://images.unsplash.com/photo-1560518883-ce09059eeffa?auto=format&fit=crop&w=1200&q=80","id":"00001-tst-002","preco":510000.0,"preco_aluguel":510000.0,"preco_venda":510000.0,"quartos":3,"subtipo":"","suites":1,"tipo":"casa","titulo":"Casa com quintal na Vila Casoni","uf":"PR","vagas":2},{"andar":0,"andares":0,"ano_construcao":0,"area":92.0,"area_terreno":92.0,"area_util":0.0,"bairro":"Gleba Palhano","banheiros":2,"cidade":"Londrina","cliente_id":"00001","features":[],"finalidade":"aluguel","foto":"https://images.unsplash.com/photo-1560518883-ce09059eeffa?auto=format&fit=crop&w=1200&q=80","id":"00001-tst-003","preco":2800.0,"preco_aluguel":2800.0,"preco_venda":2800.0,"quartos":3,"subtipo":"","suites":1,"tipo":"apartamento","titulo":"Apartamento para alugar na Gleba Palhano","uf":"PR","vagas":2},{"andar":0,"andares":0,"ano_construcao":0,"area":120.0,"area_terreno":120.0,"area_util":0.0,"bairro":"Jardim Bandeirantes","banheiros":2,"cidade":"Londrina","cliente_id":"00001","features":[],"finalidade":"venda","foto":"https://images.unsplash.com/photo-1560518883-ce09059eeffa?auto=format&fit=crop&w=1200&q=80","id":"00001-tst-004","preco":390000.0,"preco_aluguel":390000.0,"preco_venda":390000.0,"quartos":3,"subtipo":"","suites":1,"tipo":"casa","titulo":"Casa no Jardim Bandeirantes","uf":"PR","vagas":2},{"andar":0,"andares":0,"ano_construcao":0,"area":300.0,"area_terreno":300.0,"area_util":0.0,"bairro":"Jardim Leonor","banheiros":0,"cidade":"Londrina","cliente_id":"00001","features":[],"finalidade":"venda","foto":"https://images.unsplash.com/photo-1560518883-ce09059eeffa?auto=format&fit=crop&w=1200&q=80","id":"00001-tst-005","preco":180000.0,"preco_aluguel":180000.0,"preco_venda":180000.0,"quartos":0,"subtipo":"","suites":0,"tipo":"terreno","titulo":"Terreno no Jardim Leonor","uf":"PR","vagas":0},{"andar":0,"andares":0,"ano_construcao":0,"area":1000.0,"area_terreno":1000.0,"area_util":0.0,"bairro":"Limoeiro","banheiros":2,"cidade":"Londrina","cliente_id":"00001","features":[],"finalidade":"venda","foto":"https://images.unsplash.com/photo-1560518883-ce09059eeffa?auto=format&fit=crop&w=1200&q=80","id":"00001-tst-006","preco":650000.0,"preco_aluguel":650000.0,"preco_venda":650000.0,"quartos":2,"subtipo":"","suites":0,"tipo":"rural","titulo":"Chácara compacta em área rural","uf":"PR","vagas":3},{"andar":0,"andares":0,"ano_construcao":0,"area":20000.0,"area_terreno":20000.0,"area_util":0.0,"bairro":"Guaravera","banheiros":2,"cidade":"Londrina","cliente_id":"00001","features":[],"finalidade":"venda","foto":"https://images.unsplash.com/photo-1560518883-ce09059eeffa?auto=format&fit=crop&w=1200&q=80","id":"00001-tst-007","preco":1350000.0,"preco_aluguel":1350000.0,"preco_venda":1350000.0,"quartos":3,"subtipo":"","suites":1,"tipo":"rural","titulo":"Sítio produtivo de dois hectares","uf":"PR","vagas":4},{"andar":0,"andares":0,"ano_construcao":0,"area":48.0,"area_terreno":48.0,"area_util":0.0,"bairro":"Centro","banheiros":1,"cidade":"Londrina","cliente_id":"00001","features":[],"finalidade":"aluguel","foto":"https://images.unsplash.com/photo-1560518883-ce09059eeffa?auto=format&fit=crop&w=1200&q=80","id":"00001-tst-008","preco":1900.0,"preco_aluguel":1900.0,"preco_venda":1900.0,"quartos":0,"subtipo":"","suites":0,"tipo":"comercial","titulo":"Sala comercial no Centro","uf":"PR","vagas":1},{"andar":0,"andares":0,"ano_construcao":0,"area":620.0,"area_terreno":620.0,"area_util":0.0,"bairro":"Cinco Conjuntos","banheiros":2,"cidade":"Londrina","cliente_id":"00001","features":[],"finalidade":"aluguel","foto":"https://images.unsplash.com/photo-1560518883-ce09059eeffa?auto=format&fit=crop&w=1200&q=80","id":"00001-tst-009","preco":8500.0,"preco_aluguel":8500.0,"preco_venda":8500.0,"quartos":0,"subtipo":"","suites":0,"tipo":"galpao","titulo":"Galpão na Zona Norte","uf":"PR","vagas":6},{"andar":0,"andares":0,"ano_construcao":0,"area":58.0,"area_terreno":58.0,"area_util":0.0,"bairro":"Jardim Sabará","banheiros":1,"cidade":"Londrina","cliente_id":"00001","features":[],"finalidade":"aluguel","foto":"https://images.unsplash.com/photo-1560518883-ce09059eeffa?auto=format&fit=crop&w=1200&q=80","id":"00001-tst-010","preco":1650.0,"preco_aluguel":1650.0,"preco_venda":1650.0,"quartos":2,"subtipo":"","suites":0,"tipo":"apartamento","titulo":"Apartamento próximo à UEL","uf":"PR","vagas":1},{"andar":0,"andares":0,"ano_construcao":0,"area":132.0,"area_terreno":132.0,"area_util":0.0,"bairro":"Jardim Califórnia","banheiros":2,"cidade":"Londrina","cliente_id":"00001","features":[],"finalidade":"venda","foto":"https://images.unsplash.com/photo-1560518883-ce09059eeffa?auto=format&fit=crop&w=1200&q=80","id":"00001-tst-011","preco":460000.0,"preco_aluguel":460000.0,"preco_venda":460000.0,"quartos":3,"subtipo":"","suites":1,"tipo":"casa","titulo":"Casa no Jardim Califórnia","uf":"PR","vagas":2},{"andar":0,"andares":0,"ano_construcao":0,"area":105.0,"area_terreno":105.0,"area_util":0.0,"bairro":"Aurora","banheiros":2,"cidade":"Londrina","cliente_id":"00001","features":[],"finalidade":"venda","foto":"https://images.unsplash.com/photo-1560518883-ce09059eeffa?auto=format&fit=crop&w=1200&q=80","id":"00001-tst-012","preco":580000.0,"preco_aluguel":580000.0,"preco_venda":580000.0,"quartos":3,"subtipo":"","suites":1,"tipo":"apartamento","titulo":"Apartamento no Aurora","uf":"PR","vagas":2},{"andar":0,"andares":0,"ano_construcao":0,"area":540.0,"area_terreno":540.0,"area_util":0.0,"bairro":"Higienópolis","banheiros":0,"cidade":"Londrina","cliente_id":"00001","features":[],"finalidade":"venda","foto":"https://images.unsplash.com/photo-1560518883-ce09059eeffa?auto=format&fit=crop&w=1200&q=80","id":"00001-tst-013","preco":980000.0,"preco_aluguel":980000.0,"preco_venda":980000.0,"quartos":0,"subtipo":"","suites":0,"tipo":"terreno","titulo":"Terreno comercial na Higienópolis","uf":"PR","vagas":0},{"andar":0,"andares":0,"ano_construcao":0,"area":160.0,"area_terreno":160.0,"area_util":0.0,"bairro":"Conjunto Vivi Xavier","banheiros":2,"cidade":"Londrina","cliente_id":"00001","features":[],"finalidade":"aluguel","foto":"https://images.unsplash.com/photo-1560518883-ce09059eeffa?auto=format&fit=crop&w=1200&q=80","id":"00001-tst-014","preco":4200.0,"preco_aluguel":4200.0,"preco_venda":4200.0,"quartos":0,"subtipo":"","suites":0,"tipo":"comercial","titulo":"Loja térrea na Avenida Saul Elkind","uf":"PR","vagas":3},{"andar":0,"andares":0,"ano_construcao":0,"area":110.0,"area_terreno":110.0,"area_util":0.0,"bairro":"Aeroporto","banheiros":2,"cidade":"Londrina","cliente_id":"00001","features":[],"finalidade":"aluguel","foto":"https://images.unsplash.com/photo-1560518883-ce09059eeffa?auto=format&fit=crop&w=1200&q=80","id":"00001-tst-015","preco":2200.0,"preco_aluguel":2200.0,"preco_venda":2200.0,"quartos":3,"subtipo":"","suites":1,"tipo":"casa","titulo":"Casa para alugar no Aeroporto","uf":"PR","vagas":2},{"andar":0,"andares":0,"ano_construcao":0,"area":42.0,"area_terreno":42.0,"area_util":0.0,"bairro":"Centro","banheiros":1,"cidade":"Londrina","cliente_id":"00001","features":[],"finalidade":"aluguel","foto":"https://images.unsplash.com/photo-1560518883-ce09059eeffa?auto=format&fit=crop&w=1200&q=80","id":"00001-tst-016","preco":1250.0,"preco_aluguel":1250.0,"preco_venda":1250.0,"quartos":1,"subtipo":"","suites":0,"tipo":"apartamento","titulo":"Apartamento compacto no Centro","uf":"PR","vagas":0},{"andar":0,"andares":0,"ano_construcao":0,"area":360.0,"area_terreno":360.0,"area_util":0.0,"bairro":"Parque das Indústrias","banheiros":0,"cidade":"Londrina","cliente_id":"00001","features":[],"finalidade":"venda","foto":"https://images.unsplash.com/photo-1560518883-ce09059eeffa?auto=format&fit=crop&w=1200&q=80","id":"00001-tst-017","preco":240000.0,"preco_aluguel":240000.0,"preco_venda":240000.0,"quartos":0,"subtipo":"","suites":0,"tipo":"terreno","titulo":"Terreno na Zona Sul","uf":"PR","vagas":0},{"andar":0,"andares":0,"ano_construcao":0,"area":210.0,"area_terreno":210.0,"area_util":0.0,"bairro":"Jardim do Sol","banheiros":3,"cidade":"Londrina","cliente_id":"00001","features":[],"finalidade":"venda","foto":"https://images.unsplash.com/photo-1560518883-ce09059eeffa?auto=format&fit=crop&w=1200&q=80","id":"00001-tst-018","preco":720000.0,"preco_aluguel":720000.0,"preco_venda":720000.0,"quartos":4,"subtipo":"","suites":2,"tipo":"casa","titulo":"Casa ampla no Jardim do Sol","uf":"PR","vagas":3},{"andar":0,"andares":0,"ano_construcao":0,"area":600.0,"area_terreno":600.0,"area_util":0.0,"bairro":"Patrimônio Heimtal","banheiros":1,"cidade":"Londrina","cliente_id":"00001","features":[],"finalidade":"venda","foto":"https://images.unsplash.com/photo-1560518883-ce09059eeffa?auto=format&fit=crop&w=1200&q=80","id":"00001-tst-019","preco":480000.0,"preco_aluguel":480000.0,"preco_venda":480000.0,"quartos":2,"subtipo":"","suites":0,"tipo":"rural","titulo":"Chácara de seiscentos metros quadrados","uf":"PR","vagas":2},{"andar":0,"andares":0,"ano_construcao":0,"area":980.0,"area_terreno":980.0,"area_util":0.0,"bairro":"Cilo III","banheiros":4,"cidade":"Londrina","cliente_id":"00001","features":[],"finalidade":"venda","foto":"https://images.unsplash.com/photo-1560518883-ce09059eeffa?auto=format&fit=crop&w=1200&q=80","id":"00001-tst-020","preco":2100000.0,"preco_aluguel":2100000.0,"preco_venda":2100000.0,"quartos":0,"sub